{
  "schema_version": 1,
  "id": "DP-HARNESS-BRANCH-RECLAMATION",
  "title": "Harness V2 transient branch reclamation",
  "source": {
    "kind": "implementation_plan",
    "path": "docs/harness-v2/implementation-plan.md"
  },
  "requirements": [
    {
      "id": "REQ-HV2-BRANCH-RECLAMATION",
      "statement": "Harness V2 reclaims local work branches and remote queue branches with compare-and-swap once their immediate purpose ends, without creating permanent runtime evidence refs.",
      "criteria": [
        {
          "id": "CRIT-HV2-WORK-BRANCH-RECLAMATION",
          "statement": "Successful queue construction removes the exact local work branch after its reviewed payload is represented by the temporary queue candidate.",
          "negative_definitions": [
            "Deleting a work branch before the temporary queue candidate exists does not qualify.",
            "Deleting a branch whose SHA changed after review does not qualify.",
            "Leaving a completed task work branch indefinitely does not qualify."
          ],
          "evidence": {
            "gates": [
              "harness_v2"
            ],
            "scenarios": [
            "queue-work-branch-cleanup",
            "interrupted-claim-recovery",
              "work-branch-cas-conflict"
            ],
            "topology": "isolated_git_worktree_with_derived_state",
            "platforms": [
              "linux",
              "macos",
              "windows"
            ],
            "roles": [
              "developer",
            "queue-worker"
            ],
            "allow_skipped": false
          }
        },
        {
          "id": "CRIT-HV2-QUEUE-BRANCH-RECLAMATION",
          "statement": "Successful publication, cleanup recovery, explicit queue rejection, reopen, and bootstrap publication delete the exact remote and local queue ref with compare-and-swap semantics.",
          "negative_definitions": [
            "Deleting a queued candidate before publication or an explicit reject or reopen action does not qualify.",
            "Deleting a queue ref that moved to another SHA does not qualify.",
            "Creating an archive ref for a rejected temporary candidate does not qualify.",
            "Treating a failed cleanup as successful does not qualify."
          ],
          "evidence": {
            "gates": [
              "harness_v2"
            ],
            "scenarios": [
              "published-candidate-cleanup",
              "publication-recovery-cleanup",
            "rejected-candidate-direct-cleanup",
              "bootstrap-candidate-cleanup",
              "remote-queue-cas-conflict"
            ],
          "topology": "bare_remote_with_protected_head_and_temporary_queue",
            "platforms": [
              "linux",
              "macos",
              "windows"
            ],
            "roles": [
              "queue-worker",
              "publisher",
              "project-owner"
            ],
            "allow_skipped": false
          }
        },
        {
          "id": "CRIT-HV2-BRANCH-GC-RECOVERY",
          "statement": "An idempotent branch GC command reports and reclaims only unattached work refs or queue refs already reachable from protected history.",
          "negative_definitions": [
            "GC recognizing any permanent approval, state, submission, attestation, or archive namespace does not qualify.",
            "GC deleting an active or queued task candidate does not qualify.",
            "GC relying on branch age or name without evidence does not qualify.",
            "GC defaulting to destructive execution does not qualify."
          ],
          "evidence": {
            "gates": [
              "harness_v2"
            ],
            "scenarios": [
              "dry-run-default",
            "accepted-work-residue",
            "accepted-queue-residue",
            "unpublished-ref-negative-matrix"
            ],
            "topology": "mixed_local_and_remote_ref_inventory",
            "platforms": [
              "linux",
              "macos",
              "windows"
            ],
            "roles": [
              "integration-owner",
              "queue-worker"
            ],
            "allow_skipped": false
          }
        }
      ],
      "implementation_tasks": [
        "XT-103"
      ]
    }
  ]
}
