{
  "schema_version": 1,
  "id": "DP-HARNESS-V2-PILOT-REPORT",
  "title": "Harness V2 pilot evidence report",
  "source": {
    "kind": "implementation_plan",
    "path": "docs/harness-v2/implementation-plan.md"
  },
  "requirements": [
    {
      "id": "REQ-HV2-PILOT-REPORT",
      "statement": "Versioned Harness V2 documentation records completed pilot runs, measured latency, corrected retention semantics, and unresolved operational risks without overstating the sample.",
      "criteria": [
        {
          "id": "CRIT-HV2-PILOT-REPORT",
          "statement": "The implementation plan and worklog identify the exact candidate runs, accepted commits, observed latency, corrected retention model, and residual SLO limits.",
          "negative_definitions": [
            "Chat-only evidence does not qualify.",
            "Marking an unmeasured P95 or concurrency target as passing does not qualify.",
            "Leaving the pilot status as pending does not qualify.",
            "A local-only Gate result does not qualify."
          ],
          "evidence": {
            "gates": [
              "layout"
            ],
            "scenarios": [
              "pilot-a-evidence-report",
              "pilot-b-evidence-report",
              "residual-risk-report"
            ],
            "topology": "single_task_train_depth_1",
            "platforms": [
              "linux"
            ],
            "roles": [
              "documentation-owner",
              "queue-worker",
              "publisher"
            ],
            "allow_skipped": false
          }
        }
      ],
      "implementation_tasks": [
        "XT-101"
      ]
    }
  ]
}
